{
  "$schema": "https://json-schema.org/draft/2020-12/schema",
  "$id": "a-end-face-short-line-candidate-config/1",
  "title": "137 A-End-Face Short-Line Candidate Configuration v1/v2",
  "type": "object",
  "required": ["schemaVersion", "candidateId", "algorithmVersion", "features", "template", "search", "gates"],
  "properties": {
    "schemaVersion": {"enum": ["a-end-face-short-line-candidate-config/1", "a-end-face-short-line-candidate-config/2"]},
    "candidateId": {"enum": ["reference-gradient-registration-v1", "main-housing-registration-v2"]},
    "algorithmVersion": {"type": "string", "minLength": 1},
    "features": {"const": ["19", "30"]},
    "template": {
      "type": "object",
      "required": ["alongExtensionPx", "halfWidthPx", "sampleStepPx"],
      "properties": {
        "alongExtensionPx": {"type": "number", "minimum": 0},
        "halfWidthPx": {"type": "number", "exclusiveMinimum": 0},
        "sampleStepPx": {"type": "number", "exclusiveMinimum": 0}
      },
      "additionalProperties": false
    },
    "search": {
      "type": "object",
      "required": ["coarse", "fine"],
      "properties": {
        "coarse": {"$ref": "#/$defs/searchLevel"},
        "fine": {"$ref": "#/$defs/searchLevel"}
      },
      "additionalProperties": false
    },
    "gates": {
      "type": "object",
      "required": ["minimumPredictionLengthPx", "maximumPredictionLengthPx", "minimumCoverageRatio", "minimumTemplateStd", "minimumRoiContrast", "minimumGradientP90", "minimumCorrelation", "minimumRobustZ", "minimumSeparatedPeakGap", "separationAngleDeg", "separationLongitudinalPx", "separationLateralPx", "maximumAngleCorrectionDeg"],
      "properties": {
        "minimumPredictionLengthPx": {"type": "number", "exclusiveMinimum": 0},
        "maximumPredictionLengthPx": {"type": "number", "exclusiveMinimum": 0},
        "minimumCoverageRatio": {"type": "number", "exclusiveMinimum": 0, "maximum": 1},
        "minimumTemplateStd": {"type": "number", "minimum": 0},
        "minimumRoiContrast": {"type": "number", "minimum": 0},
        "minimumGradientP90": {"type": "number", "minimum": 0},
        "minimumCorrelation": {"type": "number", "minimum": -1, "maximum": 1},
        "minimumRobustZ": {"type": "number", "minimum": 0},
        "minimumSeparatedPeakGap": {"type": "number", "minimum": 0},
        "separationAngleDeg": {"type": "number", "minimum": 0},
        "separationLongitudinalPx": {"type": "number", "minimum": 0},
        "separationLateralPx": {"type": "number", "minimum": 0},
        "maximumAngleCorrectionDeg": {"type": "number", "minimum": 0}
      },
      "additionalProperties": false
    },
    "registration": {"$ref": "#/$defs/registration"}
  },
  "$defs": {
    "searchLevel": {
      "type": "object",
      "required": ["angleRadiusDeg", "angleStepDeg", "longitudinalRadiusPx", "longitudinalStepPx", "lateralRadiusPx", "lateralStepPx"],
      "properties": {
        "angleRadiusDeg": {"type": "number", "exclusiveMinimum": 0},
        "angleStepDeg": {"type": "number", "exclusiveMinimum": 0},
        "longitudinalRadiusPx": {"type": "number", "exclusiveMinimum": 0},
        "longitudinalStepPx": {"type": "number", "exclusiveMinimum": 0},
        "lateralRadiusPx": {"type": "number", "exclusiveMinimum": 0},
        "lateralStepPx": {"type": "number", "exclusiveMinimum": 0}
      },
      "additionalProperties": false
    },
    "registration": {
      "type": "object",
      "required": ["downsampleFactor", "foregroundThreshold", "minimumComponentPixels", "minimumDiameterPx", "maximumAspectError", "minimumComponentFillRatio", "maximumComponentFillRatio", "radialRayCount", "minimumEdgeCoverageRatio", "maximumCircularResidualRatio", "minimumScale", "maximumScale", "minimumReferenceRadiusMarginRatio", "angularSamples", "radialSamples", "minimumRotationScore", "minimumRotationMargin", "rotationSeparationDeg", "minimumInstanceScore", "minimumInstanceMargin"],
      "properties": {
        "downsampleFactor": {"type": "integer", "minimum": 1},
        "foregroundThreshold": {"type": "number"},
        "minimumComponentPixels": {"type": "integer", "minimum": 1},
        "minimumDiameterPx": {"type": "number", "exclusiveMinimum": 0},
        "maximumAspectError": {"type": "number", "minimum": 0},
        "minimumComponentFillRatio": {"type": "number", "minimum": 0, "maximum": 1},
        "maximumComponentFillRatio": {"type": "number", "minimum": 0, "maximum": 1},
        "radialRayCount": {"type": "integer", "minimum": 1},
        "minimumEdgeCoverageRatio": {"type": "number", "minimum": 0, "maximum": 1},
        "maximumCircularResidualRatio": {"type": "number", "minimum": 0},
        "minimumScale": {"type": "number", "exclusiveMinimum": 0},
        "maximumScale": {"type": "number", "exclusiveMinimum": 0},
        "minimumReferenceRadiusMarginRatio": {"type": "number", "minimum": 0, "exclusiveMaximum": 1},
        "angularSamples": {"type": "integer", "minimum": 1},
        "radialSamples": {"type": "integer", "minimum": 1},
        "minimumRotationScore": {"type": "number"},
        "minimumRotationMargin": {"type": "number", "minimum": 0},
        "rotationSeparationDeg": {"type": "number", "exclusiveMinimum": 0},
        "minimumInstanceScore": {"type": "number"},
        "minimumInstanceMargin": {"type": "number", "minimum": 0}
      },
      "additionalProperties": false
    }
  },
  "allOf": [
    {
      "if": {"properties": {"candidateId": {"const": "main-housing-registration-v2"}}},
      "then": {
        "required": ["registration"],
        "properties": {"schemaVersion": {"const": "a-end-face-short-line-candidate-config/2"}}
      },
      "else": {
        "not": {"required": ["registration"]},
        "properties": {"schemaVersion": {"const": "a-end-face-short-line-candidate-config/1"}}
      }
    }
  ],
  "additionalProperties": false
}
